<?xml version="1.0" encoding="UTF-8"?>
<pescaderia xmlns:xsi="http://www.w3.org/2001/XMLSchema-instance" xsi:noNamespaceSchemaLocation="Pescaderia.xsd">
<pescados>
  <pescado>
    <nombre>Merluza</nombre>
    <tipo>Pescado blanco</tipo>
    <temporada>Anual</temporada>
    <procedencia>Nacional</procedencia>
  </pescado>
  <pescado>
    <nombre>Salmon</nombre>
    <tipo>Pescado azul</tipo>
    <temporada>Anual</temporada>
    <procedencia>Importado</procedencia>
  </pescado>
  <pescado>
    <nombre>Bacalao</nombre>
    <tipo>Pescado blanco</tipo>
    <temporada>03,04,05,06</temporada>
    <procedencia>Atlántico Norte</procedencia>
  </pescado>
</pescados>
<mariscos>
  <marisco>
    <nombre> Mejillon</nombre>
    <temporada>09,10,11,12,01,02,03,04</temporada>
    <procedencia>Galicia</procedencia>
  </marisco>
  <marisco>
    <nombre>Gamba</nombre>
    <temporada>05,06,07,08</temporada>
    <procedencia>Atlantico</procedencia>
  </marisco>
  <marisco>
    <nombre>Cangrejo</nombre>
    <temporada>07,08,09</temporada>
    <procedencia>Cantabrico</procedencia>
  </marisco>
</mariscos>
</pescaderia>